{"schemaVersion":1,"version":"2026.08.31.1825","publishedUtc":"2026-08-31T15:25:26.1502240Z","publisher":"CN=Win11Rescue Update Publisher","publisherThumbprint":"075685CEB4D796E69E8275486E444EB62826EBC5","rules":[{"id":"WRR-BL-001","title":"BitLocker volume is locked","severity":"warning","confidence":99,"conditions":[{"fact":"bitlocker.anyLocked","operator":"eq","value":true}],"probableCause":"At least one BitLocker-protected volume is locked, so Windows and servicing data may be inaccessible.","recommendation":"Unlock the protected Windows volume with the 48-digit BitLocker Recovery Key, then rescan.","repairAction":"BITLOCKER_UNLOCK","risk":"low"},{"id":"WRR-OS-001","title":"No accessible Windows installation detected","severity":"critical","confidence":75,"conditions":[{"fact":"windows.count","operator":"eq","value":0},{"fact":"bitlocker.anyLocked","operator":"eq","value":false}],"probableCause":"Windows is not visible to WinPE. Possible causes include a missing storage driver, filesystem damage, an offline disk, or a missing Windows partition.","recommendation":"Check disk visibility and storage controller drivers before attempting any boot repair.","repairAction":"STORAGE_DIAGNOSIS","risk":"low"},{"id":"WRR-BOOT-001","title":"EFI present but BCD is not readable","severity":"critical","confidence":88,"conditions":[{"fact":"windows.count","operator":"gt","value":0},{"fact":"efi.count","operator":"gt","value":0},{"fact":"bcd.readableCount","operator":"eq","value":0}],"probableCause":"The Windows installation and EFI System Partition are present, but no readable BCD store was found.","recommendation":"Back up the existing EFI/BCD data and consider rebuilding the Windows boot files with BCDBoot.","repairAction":"BCD_REBUILD","risk":"medium"},{"id":"WRR-SERV-001","title":"Pending servicing operation detected","severity":"warning","confidence":82,"conditions":[{"fact":"servicing.anyPending","operator":"eq","value":true}],"probableCause":"Windows has an incomplete or pending servicing transaction. If the boot failure started during or immediately after an update, the pending transaction may be involved.","recommendation":"Correlate CBS/Panther logs and the most recent update before considering DISM /RevertPendingActions.","repairAction":"REVERT_PENDING_SERVICING","risk":"medium"},{"id":"WRR-BOOT-HEALTHY","title":"Basic boot structures are visible","severity":"info","confidence":90,"conditions":[{"fact":"windows.count","operator":"gt","value":0},{"fact":"efi.count","operator":"gt","value":0},{"fact":"bcd.readableCount","operator":"gt","value":0}],"probableCause":"The Windows installation, EFI partition, and at least one readable BCD store are visible. A pure BCD-loss scenario is less likely.","recommendation":"Continue with servicing, filesystem, system-file, and recent-update diagnostics.","repairAction":"NONE","risk":"none"}]}